titre	auteur	co_auteurs	date	texte	url	catégorie	source	id_post_reddit	subreddit	upvotes	score	nombre_commentaires	flairs
"Investigating Explanations in Conditional and Highly Automated Driving:
  The Effects of Situation Awareness and Modality"	Lilit Avetisyan	Jackie Ayoub, Feng Zhou	2022-07-15 14:30:15	With the level of automation increases in vehicles, such as conditional and highly automated vehicles (AVs), drivers are becoming increasingly out of the control loop, especially in unexpected driving scenarios. Although it might be not necessary to require the drivers to intervene on most occasions, it is still important to improve drivers' situation awareness (SA) in unexpected driving scenarios to improve their trust in and acceptance of AVs. In this study, we conceptualized SA at the levels of perception (SA L1), comprehension (SA L2), and projection (SA L3), and proposed an SA level-based explanation framework based on explainable AI. Then, we examined the effects of these explanations and their modalities on drivers' situational trust, cognitive workload, as well as explanation satisfaction. A three (SA levels: SA L1, SA L2 and SA L3) by two (explanation modalities: visual, visual + audio) between-subjects experiment was conducted with 340 participants recruited from Amazon Mechanical Turk. The results indicated that by designing the explanations using the proposed SA-based framework, participants could redirect their attention to the important objects in the traffic and understand their meaning for the AV system. This improved their SA and filled the gap of understanding the correspondence of AV's behavior in the particular situations which also increased their situational trust in AV. The results showed that participants reported the highest trust with SA L2 explanations, although the mental workload was assessed higher in this level. The results also provided insights into the relationship between the amount of information in explanations and modalities, showing that participants were more satisfied with visual-only explanations in the SA L1 and SA L2 conditions and were more satisfied with visual and auditory explanations in the SA L3 condition.	http://arxiv.org/abs/2207.07496v1	cs	arxiv					0.0	
"Do They Accept or Resist Cybersecurity Measures? Development and
  Validation of the 13-Item Security Attitude Inventory (SA-13)"	Cori Faklaris	Laura Dabbish, Jason I. Hong	2022-04-06 22:14:36	We present SA-13, the 13-item Security Attitude inventory. We develop and validate this assessment of cybersecurity attitudes by conducting an exploratory factor analysis, confirmatory factor analysis, and other tests with data from a U.S. Census-weighted Qualtrics panel (N=209). Beyond a core six indicators of Engagement with Security Measures (SA-Engagement, three items) and Attentiveness to Security Measures (SA-Attentiveness, three items), our SA-13 inventory adds indicators of Resistance to Security Measures (SA-Resistance, four items) and Concernedness with Improving Compliance (SA-Concernedness, three items). SA-13 and the subscales exhibit desirable psychometric qualities; and higher scores on SA-13 and on the SA-Engagement and SA-Attentiveness subscales are associated with higher scores for security behavior intention and for self-reported recent security behaviors. SA-13 and the subscales are useful for researchers and security awareness teams who need a lightweight survey measure of user security attitudes. The composite score of the 13 indicators provides a compact measurement of cybersecurity decisional balance.	http://arxiv.org/abs/2204.03114v1	cs	arxiv					0.0	
"Decentralized Spectrum Access System: Vision, Challenges, and a
  Blockchain Solution"	Yang Xiao	Shanghao Shi, Wenjing Lou, Chonggang Wang, Xu Li, Ning Zhang, Y. Thomas Hou, Jeffrey H. Reed	2021-12-10 15:47:54	Spectrum access system (SAS) is widely considered the de facto solution to coordinating dynamic spectrum sharing (DSS) and protecting incumbent users. The current SAS paradigm prescribed by the FCC for the CBRS band and standardized by the WInnForum follows a centralized service model in that a spectrum user subscribes to a SAS server for spectrum allocation service. This model, however, neither tolerates SAS server failures (crash or Byzantine) nor resists dishonest SAS administrators, leading to serious concerns on SAS system reliability and trustworthiness. This is especially concerning for the evolving DSS landscape where an increasing number of SAS service providers and heterogeneous user requirements are coming up. To address these challenges, we propose a novel blockchain-based decentralized SAS architecture called BD-SAS that provides SAS services securely and efficiently, without relying on the trust of each individual SAS server for the overall system trustworthiness. In BD-SAS, a global blockchain (G-Chain) is used for spectrum regulatory compliance while smart contract-enabled local blockchains (L-Chains) are instantiated in individual spectrum zones for automating spectrum access assignment per user request. We hope our vision of a decentralized SAS, the BD-SAS architecture, and discussion on future challenges can open up a new direction towards reliable spectrum management in a decentralized manner.	http://dx.doi.org/10.1109/MWC.101.2100354	cs	arxiv					0.0	
ULA Fitting for Sparse Array Design	Wanlu Shi	Sergiy A. Vorobyov, Yingsong Li	2021-02-05 03:50:13	Sparse array (SA) geometries, such as coprime and nested arrays, can be regarded as a concatenation of two uniform linear arrays (ULAs). Such arrays lead to a significant increase of the number of degrees of freedom (DOF) when the second-order information is utilized, i.e., they provide long virtual difference coarray (DCA). Thus, the idea of this paper is based on the observation that SAs can be fitted through concatenation of sub-ULAs. A corresponding SA design principle, called ULA fitting, is then proposed. It aims to design SAs from sub-ULAs. Towards this goal, a polynomial model for arrays is used, and based on it, a DCA structure is analyzed if SA is composed of multiple sub-ULAs. SA design with low mutual coupling is considered. ULA fitting enables to transfer the SA design requirements, such as hole free, low mutual coupling and other requirements, into pseudo polynomial equation, and hence, find particular solutions. We mainly focus on designing SAs with low mutual coupling and large uniform DOF. Two examples of SAs with closed-form expressions are then developed based on ULA fitting. Numerical experiments verify the superiority of the proposed SAs in the presence of heavy mutual coupling.	http://dx.doi.org/10.1109/TSP.2021.3125609	cs	arxiv					0.0	
"Multi-view SA-LA Net: A framework for simultaneous segmentation of RV on
  multi-view cardiac MR Images"	Sana Jabbar	Syed Talha Bukhari, Hassan Mohy-ud-Din	2021-10-01 23:26:51	We proposed a multi-view SA-LA model for simultaneous segmentation of RV on the short-axis (SA) and long-axis (LA) cardiac MR images. The multi-view SA-LA model is a multi-encoder, multi-decoder U-Net architecture based on the U-Net model. One encoder-decoder pair segments the RV on SA images and the other pair on LA images. Multi-view SA-LA model assembles an extremely rich set of synergistic features, at the root of the encoder branch, by combining feature maps learned from matched SA and LA cardiac MR images. Segmentation performance is further enhanced by: (1) incorporating spatial context of LV as a prior and (2) performing deep supervision in the last three layers of the decoder branch. Multi-view SA-LA model was extensively evaluated on the MICCAI 2021 Multi- Disease, Multi-View, and Multi- Centre RV Segmentation Challenge dataset (M&Ms-2021). M&Ms-2021 dataset consists of multi-phase, multi-view cardiac MR images of 360 subjects acquired at four clinical centers with three different vendors. On the challenge cohort (160 subjects), the proposed multi-view SA-LA model achieved a Dice Score of 91% and Hausdorff distance of 11.2 mm on short-axis images and a Dice Score of 89.6% and Hausdorff distance of 8.1 mm on long-axis images. Moreover, multi-view SA-LA model exhibited strong generalization to unseen RV related pathologies including Dilated Right Ventricle (DSC: SA 91.41%, LA 89.63%) and Tricuspidal Regurgitation (DSC: SA 91.40%, LA 90.40%) with low variance (std_DSC: SA <5%, LA<6%).	http://arxiv.org/abs/2110.00682v1	cs	arxiv					0.0	
Software Analytics to Software Domains: A Systematic Literature Review	Tamer Mohamed Abdelltif	Luiz Fernando Capretz, Danny Ho	2015-11-12 22:06:58	Software Analytics (SA) is a new branch of big data analytics that has recently emerged (2011). What distinguishes SA from direct software analysis is that it links data mined from many different software artifacts to obtain valuable insights. These insights are useful for the decision-making process throughout the different phases of the software lifecycle. Since SA is currently a hot and promising topic, we have conducted a systematic literature review, presented in this paper, to identify gaps in knowledge and open research areas in SA. Because many researchers are still confused about the true potential of SA, we had to filter out available research papers to obtain the most SA-relevant work for our review. This filtration yielded 19 studies out of 135. We have based our systematic review on four main factors: which software practitioners SA targets, which domains are covered by SA, which artifacts are extracted by SA, and whether these artifacts are linked or not. The results of our review have shown that much of the available SA research only serves the needs of developers. Also, much of the available research uses only one artifact which, in turn, means fewer links between artifacts and fewer insights. This shows that the available SA research work is still embryonic leaving plenty of room for future research in the SA field.	http://dx.doi.org/10.1109/BIGDSE.2015.14	cs	arxiv					0.0	
Decomposability for stable processes	Yizao Wang	Stilian A. Stoev, Parthanil Roy	2011-05-09 19:55:12	We characterize all possible independent symmetric alpha-stable (SaS) components of an SaS process, 0<alpha<2. In particular, we focus on stationary SaS processes and their independent stationary SaS components. We also develop a parallel characterization theory for max-stable processes.	http://arxiv.org/abs/1105.1765v2	cs	arxiv					0.0	
"A Review of Situation Awareness Assessment Approaches in Aviation
  Environments"	Thanh Nguyen	Chee Peng Lim, Ngoc Duy Nguyen, Lee Gordon-Brown, Saeid Nahavandi	2018-03-06 11:17:12	Situation awareness (SA) is an important constituent in human information processing and essential in pilots' decision-making processes. Acquiring and maintaining appropriate levels of SA is critical in aviation environments as it affects all decisions and actions taking place in flights and air traffic control. This paper provides an overview of recent measurement models and approaches to establishing and enhancing SA in aviation environments. Many aspects of SA are examined including the classification of SA techniques into six categories, and different theoretical SA models from individual, to shared or team, and to distributed or system levels. Quantitative and qualitative perspectives pertaining to SA methods and issues of SA for unmanned vehicles are also addressed. Furthermore, future research directions regarding SA assessment approaches are raised to deal with shortcomings of the existing state-of-the-art methods in the literature.	http://dx.doi.org/10.1109/JSYST.2019.2918283	cs	arxiv					0.0	
How Can Self-Attention Networks Recognize Dyck-n Languages?	Javid Ebrahimi	Dhruv Gelda, Wei Zhang	2020-10-09 00:03:17	We focus on the recognition of Dyck-n ($\mathcal{D}_n$) languages with self-attention (SA) networks, which has been deemed to be a difficult task for these networks. We compare the performance of two variants of SA, one with a starting symbol (SA$^+$) and one without (SA$^-$). Our results show that SA$^+$ is able to generalize to longer sequences and deeper dependencies. For $\mathcal{D}_2$, we find that SA$^-$ completely breaks down on long sequences whereas the accuracy of SA$^+$ is 58.82$\%$. We find attention maps learned by $\text{SA}{^+}$ to be amenable to interpretation and compatible with a stack-based language recognizer. Surprisingly, the performance of SA networks is at par with LSTMs, which provides evidence on the ability of SA to learn hierarchies without recursion.	http://arxiv.org/abs/2010.04303v1	cs	arxiv					0.0	
Minimum Bayes Risk Training for End-to-End Speaker-Attributed ASR	Naoyuki Kanda	Zhong Meng, Liang Lu, Yashesh Gaur, Xiaofei Wang, Zhuo Chen, Takuya Yoshioka	2020-11-03 22:28:57	Recently, an end-to-end speaker-attributed automatic speech recognition (E2E SA-ASR) model was proposed as a joint model of speaker counting, speech recognition and speaker identification for monaural overlapped speech. In the previous study, the model parameters were trained based on the speaker-attributed maximum mutual information (SA-MMI) criterion, with which the joint posterior probability for multi-talker transcription and speaker identification are maximized over training data. Although SA-MMI training showed promising results for overlapped speech consisting of various numbers of speakers, the training criterion was not directly linked to the final evaluation metric, i.e., speaker-attributed word error rate (SA-WER). In this paper, we propose a speaker-attributed minimum Bayes risk (SA-MBR) training method where the parameters are trained to directly minimize the expected SA-WER over the training data. Experiments using the LibriSpeech corpus show that the proposed SA-MBR training reduces the SA-WER by 9.0 % relative compared with the SA-MMI-trained model.	http://arxiv.org/abs/2011.02921v1	cs	arxiv					0.0	
"Using Eye-tracking Data to Predict Situation Awareness in Real Time
  during Takeover Transitions in Conditionally Automated Driving"	Feng Zhou	X. Jessie Yang, Joost de Winter	2021-03-27 02:42:41	Situation awareness (SA) is critical to improving takeover performance during the transition period from automated driving to manual driving. Although many studies measured SA during or after the driving task, few studies have attempted to predict SA in real time in automated driving. In this work, we propose to predict SA during the takeover transition period in conditionally automated driving using eye-tracking and self-reported data. First, a tree ensemble machine learning model, named LightGBM (Light Gradient Boosting Machine), was used to predict SA. Second, in order to understand what factors influenced SA and how, SHAP (SHapley Additive exPlanations) values of individual predictor variables in the LightGBM model were calculated. These SHAP values explained the prediction model by identifying the most important factors and their effects on SA, which further improved the model performance of LightGBM through feature selection. We standardized SA between 0 and 1 by aggregating three performance measures (i.e., placement, distance, and speed estimation of vehicles with regard to the ego-vehicle) of SA in recreating simulated driving scenarios, after 33 participants viewed 32 videos with six lengths between 1 and 20 s. Using only eye-tracking data, our proposed model outperformed other selected machine learning models, having a root-mean-squared error (RMSE) of 0.121, a mean absolute error (MAE) of 0.096, and a 0.719 correlation coefficient between the predicted SA and the ground truth. The code is available at https://github.com/refengchou/Situation-awareness-prediction. Our proposed model provided important implications on how to monitor and predict SA in real time in automated driving using eye-tracking data.	http://arxiv.org/abs/2103.14792v1	cs	arxiv					0.0	
"Self-adjoint differential operators assosiated with self-adjoint
  differential expressions"	B. L. Voronov	D. M. Gitman, I. V. Tyutin	2006-03-21 21:24:39	Considerable attention has been recently focused on quantum-mechanical systems with boundaries and/or singular potentials for which the construction of physical observables as self-adjoint (s.a.) operators is a nontrivial problem. We present a comparative review of various methods of specifying ordinary s.a. differential operators generated by formally s.a. differential expressions based on the general theory of s.a. extensions of symmetric operators. The exposition is untraditional and is based on the concept of asymmetry forms generated by adjoint operators. The main attention is given to a specification of s.a. extensions by s.a. boundary conditions. All the methods are illustrated by examples of quantum-mechanical observables like momentum and Hamiltonian. In addition to the conventional methods, we propose a possible alternative way of specifying s.a. differential operators by explicit s.a. boundary conditions that generally have an asymptotic form for singular boundaries. A comparative advantage of the method is that it allows avoiding an evaluation of deficient subspaces and deficiency indices. The effectiveness of the method is illustrated by a number of examples of quantum-mechanical observables.	http://arxiv.org/abs/quant-ph/0603187v2	cs	arxiv					0.0	
"Coupling Rendering and Generative Adversarial Networks for Artificial
  SAS Image Generation"	Albert Reed	Isaac Gerg, John McKay, Daniel Brown, David Williams, Suren Jayasuriya	2019-09-13 20:30:17	Acquisition of Synthetic Aperture Sonar (SAS) datasets is bottlenecked by the costly deployment of SAS imaging systems, and even when data acquisition is possible,the data is often skewed towards containing barren seafloor rather than objects of interest. We present a novel pipeline, called SAS GAN, which couples an optical renderer with a generative adversarial network (GAN) to synthesize realistic SAS images of targets on the seafloor. This coupling enables high levels of SAS image realism while enabling control over image geometry and parameters. We demonstrate qualitative results by presenting examples of images created with our pipeline. We also present quantitative results through the use of t-SNE and the Fr\'echet Inception Distance to argue that our generated SAS imagery potentially augments SAS datasets more effectively than an off-the-shelf GAN.	http://arxiv.org/abs/1909.06436v2	cs	arxiv					0.0	
Representation of Group Isomorphisms I	Marita Ferrer	Margarita Gary, Salvador Hernández	2018-11-27 11:09:13	Let $G$ be a metric group and let $\sA ut(G)$ denote the automorphism group of $G$. If $\sA$ and $\sB$ are groups of $G$-valued maps defined on the sets $X$ and $Y$, respectively, we say that $\sA$ and $\sB$ are \emph{equivalent} if there is a group isomorphism $H\colon\sA\to\sB$ such that there is a bijective map $h\colon Y\to X$ and a map $w\colon Y\to \sA ut (G)$ satisfying $Hf(y)=w[y](f(h(y)))$ for all $y\in Y$ and $f\in \sA$. In this case, we say that $H$ is represented as a \emph{weighted composition operator}. A group isomorphism $H$ defined between $\sA$ and $\sB$ is called \emph{separating} when for each pair of maps $f,g\in \sA$ satisfying that $f^{-1}(e_G)\cup g^{-1}(e_G)=X$, it holds that $(Hf)^{-1}(e_G)\cup (Hg)^{-1}(e_G)=Y$. Our main result establishes that under some mild conditions, every separating group isomorphism can be represented as a weighted composition operator. As a consequence we establish the equivalence of two function groups if there is a biseparating isomorphism defined between them.	http://arxiv.org/abs/1811.10912v1	cs	arxiv					0.0	
A Review and Refinement of Surprise Adequacy	Michael Weiss	Rwiddhi Chakraborty, Paolo Tonella	2021-03-10 08:56:04	Surprise Adequacy (SA) is one of the emerging and most promising adequacy criteria for Deep Learning (DL) testing. As an adequacy criterion, it has been used to assess the strength of DL test suites. In addition, it has also been used to find inputs to a Deep Neural Network (DNN) which were not sufficiently represented in the training data, or to select samples for DNN retraining. However, computation of the SA metric for a test suite can be prohibitively expensive, as it involves a quadratic number of distance calculations. Hence, we developed and released a performance-optimized, but functionally equivalent, implementation of SA, reducing the evaluation time by up to 97\%. We also propose refined variants of the SA omputation algorithm, aiming to further increase the evaluation speed. We then performed an empirical study on MNIST, focused on the out-of-distribution detection capabilities of SA, which allowed us to reproduce parts of the results presented when SA was first released. The experiments show that our refined variants are substantially faster than plain SA, while producing comparable outcomes. Our experimental results exposed also an overlooked issue of SA: it can be highly sensitive to the non-determinism associated with the DNN training procedure.	http://arxiv.org/abs/2103.05939v1	cs	arxiv					0.0	
"Frozen natural orbitals for the state-averaged driven similarity
  renormalization group"	Chenyang Li	Shuxian Mao, Renke Huang, Francesco A. Evangelista	2023-12-12 06:45:05	We present a reduced-cost implementation of the state-averaged driven similarity renormalization group (SA-DSRG) based on the frozen natural orbital (FNO) approach. The natural orbitals (NOs) are obtained by diagonalizing the one-body reduced density matrix from SA-DSRG second-order perturbation theory (SA-DSRG-PT2). Subsequently, the virtual NOs with occupation numbers (ONs) smaller than a user-defined threshold are excluded from the high-level electron correlation treatment beyond SA-DSRG-PT2. An additive second-order correction is applied to the SA-DSRG Hamiltonian to reintroduce the correlation effect from the discarded orbitals. The FNO SA-DSRG method is benchmarked on 35 small organic molecules in the QUEST database. When keeping 98-99% of the cumulative ONs, the mean absolute error in the vertical transition energies due to FNO is less than 0.01 eV. Using the same FNO threshold, we observe a speedup of 9 times the conventional SA-DSRG implementation for nickel carbonyl with a quadruple-$\zeta$ basis set. The FNO approach enables third-order SA-DSRG perturbation theory computations on chloroiron corrole [FeCl(C$_{19}$H$_{11}$N$_4$)] with more than 1000 basis functions.	http://arxiv.org/abs/2312.07008v1	cs	arxiv					0.0	
"Pagsusuri ng RNN-based Transfer Learning Technique sa Low-Resource
  Language"	Dan John Velasco	Aucun	2020-10-13 15:06:07	Low-resource languages such as Filipino suffer from data scarcity which makes it challenging to develop NLP applications for Filipino language. The use of Transfer Learning (TL) techniques alleviates this problem in low-resource setting. In recent years, transformer-based models are proven to be effective in low-resource tasks but faces challenges in accessibility due to its high compute and memory requirements. For this reason, there's a need for a cheaper but effective alternative. This paper has three contributions. First, release a pre-trained AWD-LSTM language model for Filipino language. Second, benchmark AWD-LSTM in the Hate Speech classification task and show that it performs on par with transformer-based models. Third, analyze the the performance of AWD-LSTM in low-resource setting using degradation test and compare it with transformer-based models.   -----   Ang mga low-resource languages tulad ng Filipino ay gipit sa accessible na datos kaya't mahirap gumawa ng mga applications sa wikang ito. Ang mga Transfer Learning (TL) techniques ay malaking tulong para sa low-resource setting o mga pagkakataong gipit sa datos. Sa mga nagdaang taon, nanaig ang mga transformer-based TL techniques pagdating sa low-resource tasks ngunit ito ay mataas na compute and memory requirements kaya nangangailangan ng mas mura pero epektibong alternatibo. Ang papel na ito ay may tatlong kontribusyon. Una, maglabas ng pre-trained AWD-LSTM language model sa wikang Filipino upang maging tuntungan sa pagbuo ng mga NLP applications sa wikang Filipino. Pangalawa, mag benchmark ng AWD-LSTM sa Hate Speech classification task at ipakita na kayang nitong makipagsabayan sa mga transformer-based models. Pangatlo, suriin ang performance ng AWD-LSTM sa low-resource setting gamit ang degradation test at ikumpara ito sa mga transformer-based models.	http://arxiv.org/abs/2010.06447v2	cs	arxiv					0.0	
Sherali-Adams and the binary encoding of combinatorial principles	Stefan Dantchev	Abdul Ghani, Barnaby Martin	2019-11-01 14:30:32	We consider the Sherali-Adams (SA) refutation system together with the unusual binary encoding of certain combinatorial principles. For the unary encoding of the Pigeonhole Principle and the Least Number Principle, it is known that linear rank is required for refutations in SA, although both admit refutations of polynomial size. We prove that the binary encoding of the Pigeonhole Principle requires exponentially-sized SA refutations, whereas the binary encoding of the Least Number Principle admits logarithmic rank, polynomially-sized SA refutations. We continue by considering a refutation system between SA and Lasserre (Sum-of-Squares). In this system, the Least Number Principle requires linear rank while the Pigeonhole Principle becomes constant rank.	http://arxiv.org/abs/1911.00403v1	cs	arxiv					0.0	
"Cyclic Stochastic Optimization: Generalizations, Convergence, and
