titre	auteur	co_auteurs	date	texte	url	catégorie	source	id_post_reddit	subreddit	upvotes	score	nombre_commentaires	flairs
  Speaker-Attributed ASR on Monaural Long-Form Audio"	Naoyuki Kanda	Xiong Xiao, Jian Wu, Tianyan Zhou, Yashesh Gaur, Xiaofei Wang, Zhong Meng, Zhuo Chen, Takuya Yoshioka	2021-07-06 19:36:48	"Speaker-attributed automatic speech recognition (SA-ASR) is a task to recognize ""who spoke what"" from multi-talker recordings. An SA-ASR system usually consists of multiple modules such as speech separation, speaker diarization and ASR. On the other hand, considering the joint optimization, an end-to-end (E2E) SA-ASR model has recently been proposed with promising results on simulation data. In this paper, we present our recent study on the comparison of such modular and joint approaches towards SA-ASR on real monaural recordings. We develop state-of-the-art SA-ASR systems for both modular and joint approaches by leveraging large-scale training data, including 75 thousand hours of ASR training data and the VoxCeleb corpus for speaker representation learning. We also propose a new pipeline that performs the E2E SA-ASR model after speaker clustering. Our evaluation on the AMI meeting corpus reveals that after fine-tuning with a small real data, the joint system performs 8.9--29.9% better in accuracy compared to the best modular system while the modular system performs better before such fine-tuning. We also conduct various error analyses to show the remaining issues for the monaural SA-ASR."	http://arxiv.org/abs/2107.02852v2	cs	arxiv					0.0	
"State-Aware Proximal Pessimistic Algorithms for Offline Reinforcement
  Learning"	Chen Chen	Hongyao Tang, Yi Ma, Chao Wang, Qianli Shen, Dong Li, Jianye Hao	2022-11-28 04:56:40	Pessimism is of great importance in offline reinforcement learning (RL). One broad category of offline RL algorithms fulfills pessimism by explicit or implicit behavior regularization. However, most of them only consider policy divergence as behavior regularization, ignoring the effect of how the offline state distribution differs with that of the learning policy, which may lead to under-pessimism for some states and over-pessimism for others. Taking account of this problem, we propose a principled algorithmic framework for offline RL, called \emph{State-Aware Proximal Pessimism} (SA-PP). The key idea of SA-PP is leveraging discounted stationary state distribution ratios between the learning policy and the offline dataset to modulate the degree of behavior regularization in a state-wise manner, so that pessimism can be implemented in a more appropriate way. We first provide theoretical justifications on the superiority of SA-PP over previous algorithms, demonstrating that SA-PP produces a lower suboptimality upper bound in a broad range of settings. Furthermore, we propose a new algorithm named \emph{State-Aware Conservative Q-Learning} (SA-CQL), by building SA-PP upon representative CQL algorithm with the help of DualDICE for estimating discounted stationary state distribution ratios. Extensive experiments on standard offline RL benchmark show that SA-CQL outperforms the popular baselines on a large portion of benchmarks and attains the highest average return.	http://arxiv.org/abs/2211.15065v1	cs	arxiv					0.0	
"CNN-Assisted Steganography -- Integrating Machine Learning with
  Established Steganographic Techniques"	Andrew Havard	Theodore Manikas, Eric C. Larson, Mitchell A. Thornton	2023-04-25 00:19:23	We propose a method to improve steganography by increasing the resilience of stego-media to discovery through steganalysis. Our approach enhances a class of steganographic approaches through the inclusion of a steganographic assistant convolutional neural network (SA-CNN). Previous research showed success in discovering the presence of hidden information within stego-images using trained neural networks as steganalyzers that are applied to stego-images. Our results show that such steganalyzers are less effective when SA-CNN is employed during the generation of a stego-image. We also explore the advantages and disadvantages of representing all the possible outputs of our SA-CNN within a smaller, discrete space, rather than a continuous space. Our SA-CNN enables certain classes of parametric steganographic algorithms to be customized based on characteristics of the cover media in which information is to be embedded. Thus, SA-CNN is adaptive in the sense that it enables the core steganographic algorithm to be especially configured for each particular instance of cover media. Experimental results are provided that employ a recent steganographic technique, S-UNIWARD, both with and without the use of SA-CNN. We then apply both sets of stego-images, those produced with and without SA-CNN, to an exmaple steganalyzer, Yedroudj-Net, and we compare the results. We believe that this approach for the integration of neural networks with hand-crafted algorithms increases the reliability and adaptability of steganographic algorithms.	http://arxiv.org/abs/2304.12503v1	cs	arxiv					0.0	
"Sudden Drops in the Loss: Syntax Acquisition, Phase Transitions, and
  Simplicity Bias in MLMs"	Angelica Chen	Ravid Shwartz-Ziv, Kyunghyun Cho, Matthew L. Leavitt, Naomi Saphra	2023-09-13 20:57:11	Most interpretability research in NLP focuses on understanding the behavior and features of a fully trained model. However, certain insights into model behavior may only be accessible by observing the trajectory of the training process. We present a case study of syntax acquisition in masked language models (MLMs) that demonstrates how analyzing the evolution of interpretable artifacts throughout training deepens our understanding of emergent behavior. In particular, we study Syntactic Attention Structure (SAS), a naturally emerging property of MLMs wherein specific Transformer heads tend to focus on specific syntactic relations. We identify a brief window in pretraining when models abruptly acquire SAS, concurrent with a steep drop in loss. This breakthrough precipitates the subsequent acquisition of linguistic capabilities. We then examine the causal role of SAS by manipulating SAS during training, and demonstrate that SAS is necessary for the development of grammatical capabilities. We further find that SAS competes with other beneficial traits during training, and that briefly suppressing SAS improves model quality. These findings offer an interpretation of a real-world example of both simplicity bias and breakthrough training dynamics.	http://arxiv.org/abs/2309.07311v4	cs	arxiv					0.0	
"Robust and Attack Resilient Logic Locking with a High Application-Level
  Impact"	Yuntao Liu	Michael Zuzak, Yang Xie, Abhishek Chakraborty, Ankur Srivastava	2021-01-07 15:01:31	"Logic locking is a hardware security technique to intellectual property (IP) against security threats in the IC supply chain, especially untrusted fabs. Such techniques incorporate additional locking circuitry within an IC that induces incorrect functionality when an incorrect key is provided. The amount of error induced is known as the effectiveness of the locking technique. ""SAT attacks"" provide a strong mathematical formulation to find the correct key of locked circuits. In order to achieve high SAT resilience(i.e. complexity of SAT attacks), many conventional logic locking schemes fail to inject sufficient error into the circuit. For example, in the case of SARLock and Anti-SAT, there are usually very few (or only one) input minterms that cause any error at the circuit output. The state-of-the-art stripped functionality logic locking (SFLL) technique introduced a trade-off between SAT resilience and effectiveness. In this work, we prove that such a trade-off is universal in logic locking. In order to attain high effectiveness of locking without compromising SAT resilience, we propose a novel logic locking scheme, called Strong Anti-SAT (SAS). In addition to SAT attacks, removal-based attacks are also popular against logic locking. Based on SAS, we propose Robust SAS (RSAS) which is resilient to removal attacks and maintains the same SAT resilience and as effectiveness as SAS. SAS and RSAS have the following significant improvements over existing techniques. (1) SAT resilience of SAS and RSAS against SAT attack is not compromised by increase in effectiveness. (2) In contrast to prior work focusing solely on the circuit-level locking impact, we integrate SAS-locked modules into a processor and show that SAS has a high application-level impact. (3) Our experiments show that SAS and RSAS exhibit better SAT resilience than SFLL and have similar effectiveness."	http://arxiv.org/abs/2101.02577v1	cs	arxiv					0.0	
"Titanium:Sapphire-on-insulator for broadband tunable lasers and
  high-power amplifiers on chip"	Joshua Yang	Kasper Van Gasse, Daniil M. Lukin, Melissa A. Guidry, Geun Ho Ahn, Alexander D. White, Jelena Vučković	2023-12-01 00:07:38	Titanium:Sapphire (Ti:Sa) lasers have been essential for advancing fundamental research and technological applications. Ti:Sa lasers are unmatched in bandwidth and tuning range, yet their use is severely restricted due to their large size, cost, and need for high optical pump powers. Here, we demonstrate a monocrystalline Ti:Sa-on-insulator (Ti:SaOI) photonics platform which enables dramatic miniaturization, cost-reduction, and scalability of Ti:Sa technology. First, through fabrication of low-loss whispering gallery mode resonators, we realize a Ti:Sa laser operating with an ultra-low lasing threshold of 290 $\mu$W. Then, through orders-of-magnitude improvement in mode confinement in Ti:SaOI waveguides, we realize the first integrated solid-state (i.e., non-semiconductor) optical amplifier operating below 1 $\mu$m, with an ultra-wide bandwidth of 700 - 950 nm and peak gain of 64 dB/cm. We demonstrate unprecedented 17 dB distortion-free amplification of picosecond pulses to up to 2.3 nJ pulse energy, corresponding to a peak power of 1.0 kW. Finally, we demonstrate the first tunable integrated Ti:Sa laser, featuring narrow linewidths and a 24.7 THz tuning range, which, for the first time, can be pumped with low-cost, miniature, off-the-shelf green laser diodes. This opens doors to new modalities of Ti:Sa lasers (now occupying a footprint less than 0.15 mm$^2$), such as massively-scalable Ti:Sa laser array systems for a variety of applications. As a proof-of-concept demonstration, we employ a Ti:SaOI laser array as the sole optical control for a cavity quantum electrodynamics experiment with artificial atoms in silicon carbide. This work is a key step towards the democratization of Ti:Sa technology through a three orders-of-magnitude reduction in cost and footprint, as well as the introduction of solid-state broadband amplification of sub-micron wavelength light.	http://arxiv.org/abs/2312.00256v1	cs	arxiv					0.0	
Hypergraph Automata: A Theoretical Model for Patterned Self-assembly	Lila Kari	Steffen Kopecki, Amirhossein Simjour	2013-02-12 16:14:27	Patterned self-assembly is a process whereby coloured tiles self-assemble to build a rectangular coloured pattern. We propose self-assembly (SA) hypergraph automata as an automata-theoretic model for patterned self-assembly. We investigate the computational power of SA-hypergraph automata and show that for every recognizable picture language, there exists an SA-hypergraph automaton that accepts this language. Conversely, we prove that for any restricted SA-hypergraph automaton, there exists a Wang Tile System, a model for recognizable picture languages, that accepts the same language. The advantage of SA-hypergraph automata over Wang automata, acceptors for the class of recognizable picture languages, is that they do not rely on an a priori defined scanning strategy	http://arxiv.org/abs/1302.2840v1	cs	arxiv					0.0	
"Effects of the rotating wave and secular approximations on
  non-Markovianity"	H. Mäkelä	M. Möttönen	2013-06-26 17:56:43	We study the effect of the rotating-wave approximation (RWA) and the secular approximation (SA) on the non-Markovian behavior in the spin-boson model at zero-temperature. We find that both the RWA and SA lead to a dramatic reduction in the observed non-Markovianity. In general, non-Markovian dynamics is observed for the whole relaxation time of the system, whereas the RWA and SA lead to such dynamics only on the short time scale of the environmental correlation time. Thus, the RWA and SA are not necessarily justified in the studies of non-Markovianity although they can estimate the state of the system precisely. Furthermore, we derive an accurate analytical expression for the non-Markovianity measure without the RWA or SA. This expression yields important insight into the physics of the problem.	http://dx.doi.org/10.1103/PhysRevA.88.052111	cs	arxiv					0.0	
"Simulated annealing: in mathematical global optimization computation,
  hybrid with local or global search, and practical applications in
  crystallography and molecular modelling"	Jiapu Zhang	Aucun	2013-08-28 17:06:35	Simulated annealing (SA) was inspired from annealing in metallurgy, a technique involving heating and controlled cooling of a material to increase the size of its crystals and reduce their defects, both are attributes of the material that depend on its thermodynamic free energy. In this Paper, firstly we will study SA in details on its practical implementation. Then, hybrid pure SA with local (or global) search optimization methods allows us to be able to design several effective and efficient global search optimization methods. In order to keep the original sense of SA, we clarify our understandings of SA in crystallography and molecular modeling field through the studies of prion amyloid fibrils.	http://arxiv.org/abs/1308.6220v1	cs	arxiv					0.0	
An improved Ant Colony System for the Sequential Ordering Problem	Rafał Skinderowicz	Aucun	2017-05-02 17:17:26	It is not rare that the performance of one metaheuristic algorithm can be improved by incorporating ideas taken from another. In this article we present how Simulated Annealing (SA) can be used to improve the efficiency of the Ant Colony System (ACS) and Enhanced ACS when solving the Sequential Ordering Problem (SOP). Moreover, we show how the very same ideas can be applied to improve the convergence of a dedicated local search, i.e. the SOP-3-exchange algorithm. A statistical analysis of the proposed algorithms both in terms of finding suitable parameter values and the quality of the generated solutions is presented based on a series of computational experiments conducted on SOP instances from the well-known TSPLIB and SOPLIB2006 repositories. The proposed ACS-SA and EACS-SA algorithms often generate solutions of better quality than the ACS and EACS, respectively. Moreover, the EACS-SA algorithm combined with the proposed SOP-3-exchange-SA local search was able to find 10 new best solutions for the SOP instances from the SOPLIB2006 repository, thus improving the state-of-the-art results as known from the literature. Overall, the best known or improved solutions were found in 41 out of 48 cases.	http://dx.doi.org/10.1016/j.cor.2017.04.012	cs	arxiv					0.0	
"Language Transfer of Audio Word2Vec: Learning Audio Segment
  Representations without Target Language Data"	Chia-Hao Shen	Janet Y. Sung, Hung-Yi Lee	2017-07-19 10:54:00	Audio Word2Vec offers vector representations of fixed dimensionality for variable-length audio segments using Sequence-to-sequence Autoencoder (SA). These vector representations are shown to describe the sequential phonetic structures of the audio segments to a good degree, with real world applications such as query-by-example Spoken Term Detection (STD). This paper examines the capability of language transfer of Audio Word2Vec. We train SA from one language (source language) and use it to extract the vector representation of the audio segments of another language (target language). We found that SA can still catch phonetic structure from the audio segments of the target language if the source and target languages are similar. In query-by-example STD, we obtain the vector representations from the SA learned from a large amount of source language data, and found them surpass the representations from naive encoder and SA directly learned from a small amount of target language data. The result shows that it is possible to learn Audio Word2Vec model from high-resource languages and use it on low-resource languages. This further expands the usability of Audio Word2Vec.	http://arxiv.org/abs/1707.06519v1	cs	arxiv					0.0	
Multiband SAS Imagery	Isaac D Gerg	Aucun	2018-08-08 14:19:38	Advances in unmanned synthetic aperture sonar (SAS) imaging platforms allow for the simultaneous collection of multiband SAS imagery. The imagery is collected over several octaves and the phenomenology's interactions with the sea floor vary greatly over this range -- higher frequencies resolve proud and fine structure of the seafloor while lower frequencies resolve subsurface features and often induce internal resonance in man-made objects. Currently, analysts examine multiband imagery by viewing a single band at a time. This method makes it difficult to ascertain correlations between any pair of bands collected over the same location. To mitigate this issue, we propose methods which ingest high frequency (HF) and low frequency (LF) SAS imagery and generates a color composite creating what we call a multiband SAS (MSAS) image. The MSAS image contains the relevant portions of the HF and LF images required by an analyst to interpret the scene and are defined using a spatial saliency metric computed for each image. We then combine the saliency and acoustic backscatter measures to form the final MSAS image.	http://arxiv.org/abs/1808.02792v1	cs	arxiv					0.0	
"Concurrent Segmentation and Object Detection CNNs for Aircraft Detection
  and Identification in Satellite Images"	Damien Grosgeorge	Maxime Arbelot, Alex Goupilleau, Tugdual Ceillier, Renaud Allioux	2020-05-27 07:35:55	Detecting and identifying objects in satellite images is a very challenging task: objects of interest are often very small and features can be difficult to recognize even using very high resolution imagery. For most applications, this translates into a trade-off between recall and precision. We present here a dedicated method to detect and identify aircraft, combining two very different convolutional neural networks (CNNs): a segmentation model, based on a modified U-net architecture, and a detection model, based on the RetinaNet architecture. The results we present show that this combination outperforms significantly each unitary model, reducing drastically the false negative rate.	http://arxiv.org/abs/2005.13215v1	cs	arxiv					0.0	
"Lifelong Testing of Smart Autonomous Systems by Shepherding a Swarm of
  Watchdog Artificial Intelligence Agents"	Hussein Abbass	John Harvey, Kate Yaxley	2018-12-21 05:53:47	Artificial Intelligence (AI) technologies could be broadly categorised into Analytics and Autonomy. Analytics focuses on algorithms offering perception, comprehension, and projection of knowledge gleaned from sensorial data. Autonomy revolves around decision making, and influencing and shaping the environment through action production. A smart autonomous system (SAS) combines analytics and autonomy to understand, learn, decide and act autonomously. To be useful, SAS must be trusted and that requires testing. Lifelong learning of a SAS compounds the testing process. In the remote chance that it is possible to fully test and certify the system pre-release, which is theoretically an undecidable problem, it is near impossible to predict the future behaviours that these systems, alone or collectively, will exhibit. While it may be feasible to severely restrict such systems\textquoteright \ learning abilities to limit the potential unpredictability of their behaviours, an undesirable consequence may be severely limiting their utility. In this paper, we propose the architecture for a watchdog AI (WAI) agent dedicated to lifelong functional testing of SAS. We further propose system specifications including a level of abstraction whereby humans shepherd a swarm of WAI agents to oversee an ecosystem made of humans and SAS. The discussion extends to the challenges, pros, and cons of the proposed concept.	http://arxiv.org/abs/1812.08960v1	cs	arxiv					0.0	
"Application of the ASBM-SA closure in a turbulent flow over a hump in
  the presence of separation control"	Constantinos F. Panagiotou	Fotos S. Stylianou, Elias Gravanis, Evangelos Akylas, Stavros C. Kassinos	2020-03-01 20:44:31	We demonstrate the coupling between the Algebraic Structure-Based Model (ASBM) and the one-equation Spalart-Allmaras (SA) model, which provides an easy route to bringing structure information in engineering turbulence closures. The estimation ability of the hybrid model was tested for a flow over a hump model with no-flow control and steady suction. ASBM-SA model produced satisfactory predictions for the streamwise Reynolds stress component, while a qualitative agreement with the experiments was achieved for the transverse component. Regarding the shear stress component, ASBM-SA closure provides improved predictions compared to SA in the entire domain.	http://arxiv.org/abs/2003.00579v1	cs	arxiv					0.0	
"The structure of deterministic mass and surface fractals: theory and
  methods of analyzing small-angle scattering data"	A. Yu. Cherny	E. M. Anitas, V. A. Osipov, A. I. Kuklin	2019-01-29 20:05:33	Small-angle scattering (SAS) of X-rays, neutrons or light from ensembles of randomly oriented and placed deterministic fractal structures are studied theoretically. In the standard analysis, a very few parameters can be determined from SAS data: the fractal dimension, and the lower and upper limits of the fractal range. The self-similarity of deterministic structures allows one to obtain additional characteristics of their spatial structures. The paper considers models which can describe accurately SAS from such structures. The developed models of deterministic fractals offer many advantages in describing fractal systems, including the possibility to extract additional structural information, an analytic description of SAS intensity, and effective computational algorithms. Generalized Cantor fractals and few of its variants are used as basic examples to illustrate the above concepts and to model physical samples with mass, surface, and multi-fractal structures. The differences between the deterministic and random fractal structures in analyzing SAS data are emphasized. Several limitations are identified in order to motivate future investigations of deterministic fractal structures.	http://dx.doi.org/10.1039/C9CP00783K	cs	arxiv					0.0	
"Less Memory, Faster Speed: Refining Self-Attention Module for Image
  Reconstruction"	Zheng Wang	Jianwu Li, Ge Song, Tieling Li	2019-05-20 11:43:37	Self-attention (SA) mechanisms can capture effectively global dependencies in deep neural networks, and have been applied to natural language processing and image processing successfully. However, SA modules for image reconstruction have high time and space complexity, which restrict their applications to higher-resolution images. In this paper, we refine the SA module in self-attention generative adversarial networks (SAGAN) via adapting a non-local operation, revising the connectivity among the units in SA module and re-implementing its computational pattern, such that its time and space complexity is reduced from $\text{O}(n^2)$ to $\text{O}(n)$, but it is still equivalent to the original SA module. Further, we explore the principles behind the module and discover that our module is a special kind of channel attention mechanisms. Experimental results based on two benchmark datasets of image reconstruction, verify that under the same computational environment, two models can achieve comparable effectiveness for image reconstruction, but the proposed one runs faster and takes up less memory space.	http://arxiv.org/abs/1905.08008v1	cs	arxiv					0.0	
"State Monitoring for Situational Awareness in Rural Microgrids Using the
  IoT Infrastructure"	Seyed Amir Alavi	Mehrnaz Javadipour, Kamyar Mehran	2019-06-02 16:26:56	This paper presents an event-triggered estimation strategy and a data collection architecture for situational awareness (SA) in microgrids. An estimation agent structure based on the event-triggered Kalman filter is proposed and implemented for state estimation layer of the SA using long range wide area network (LoRAWAN) protocol. A setup has been developed which can provide enormous data collection capabilities from smart meters, in order to realise an adequate SA level in microgrids. Thingsboard Internet of things (IoT) platform is used for the SA visualisation with a customised dashboard. It is shown by using the developed estimation strategy, an adequate level of SA can be achieved with a minimum installation and communication cost to have an accurate average state estimation of the microgrid.	http://arxiv.org/abs/1906.00437v1	cs	arxiv					0.0	
"On the Convergence of Consensus Algorithms with Markovian Noise and
