titre	auteur	co_auteurs	date	texte	url	catégorie	source	id_post_reddit	subreddit	upvotes	score	nombre_commentaires	flairs
  optimal stiffness coefficient"	Yanwen Li	Decai Li, Yingsong Li	2022-09-18 15:56:10	With the rapid development of aerospace technology, the vibration problem of the spacecraft flexible structure urgently needs to be solved. Magnetic fluids are a type of multi-functional smart materials, which can be employed in shock absorbers to eliminate these vibrations. Referring to the calculation methods of stiffness coefficients of other passive dampers, the stiffness coefficient formula of magnetic fluid shock absorbers (MFSAs) was derived. Meanwhile, a novel stiffness adjustable magnetic fluid shock absorber (SA-MFSA) was proposed. On the basis of the second-order buoyancy principle, a series of SA-MFSAs were fabricated. The range of stiffness coefficients covered by these SA-MFSAs contains the optimal stiffness coefficient estimated by formulas. The repulsive force measurement and vibration attenuation experiments were conducted on these SA-MFSAs. In the case of small amplitude, the relationship between the repulsive force and the offset distance was linear. The simulation and experiment curves of repulsive forces were in good agreement. The results of vibration attenuation experiments demonstrated that the rod length and the magnetic fluid mass influence the damping efficiency of SA-MFSAs. In addition, these results verified that the SA-MFSA with the optimal stiffness coefficient performed best. Therefore, the stiffness coefficient formula can guide the design of MFSAs.	http://arxiv.org/abs/2209.08588v1	cs	arxiv					0.0	
Spectral Aware Softmax for Visible-Infrared Person Re-Identification	Lei Tan	Pingyang Dai, Qixiang Ye, Mingliang Xu, Yongjian Wu, Rongrong Ji	2023-02-03 02:57:18	Visible-infrared person re-identification (VI-ReID) aims to match specific pedestrian images from different modalities. Although suffering an extra modality discrepancy, existing methods still follow the softmax loss training paradigm, which is widely used in single-modality classification tasks. The softmax loss lacks an explicit penalty for the apparent modality gap, which adversely limits the performance upper bound of the VI-ReID task. In this paper, we propose the spectral-aware softmax (SA-Softmax) loss, which can fully explore the embedding space with the modality information and has clear interpretability. Specifically, SA-Softmax loss utilizes an asynchronous optimization strategy based on the modality prototype instead of the synchronous optimization based on the identity prototype in the original softmax loss. To encourage a high overlapping between two modalities, SA-Softmax optimizes each sample by the prototype from another spectrum. Based on the observation and analysis of SA-Softmax, we modify the SA-Softmax with the Feature Mask and Absolute-Similarity Term to alleviate the ambiguous optimization during model training. Extensive experimental evaluations conducted on RegDB and SYSU-MM01 demonstrate the superior performance of the SA-Softmax over the state-of-the-art methods in such a cross-modality condition.	http://arxiv.org/abs/2302.01512v1	cs	arxiv					0.0	
"Improving Transformer-based End-to-End Speaker Diarization by Assigning
  Auxiliary Losses to Attention Heads"	Ye-Rin Jeoung	Joon-Young Yang, Jeong-Hwan Choi, Joon-Hyuk Chang	2023-03-02 12:15:36	Transformer-based end-to-end neural speaker diarization (EEND) models utilize the multi-head self-attention (SA) mechanism to enable accurate speaker label prediction in overlapped speech regions. In this study, to enhance the training effectiveness of SA-EEND models, we propose the use of auxiliary losses for the SA heads of the transformer layers. Specifically, we assume that the attention weight matrices of an SA layer are redundant if their patterns are similar to those of the identity matrix. We then explicitly constrain such matrices to exhibit specific speaker activity patterns relevant to voice activity detection or overlapped speech detection tasks. Consequently, we expect the proposed auxiliary losses to guide the transformer layers to exhibit more diverse patterns in the attention weights, thereby reducing the assumed redundancies in the SA heads. The effectiveness of the proposed method is demonstrated using the simulated and CALLHOME datasets for two-speaker diarization tasks, reducing the diarization error rate of the conventional SA-EEND model by 32.58% and 17.11%, respectively.	http://arxiv.org/abs/2303.01192v1	cs	arxiv					0.0	
"Advances in Self-Supervised Learning for Synthetic Aperture Sonar Data
  Processing, Classification, and Pattern Recognition"	Brandon Sheffield	Frank E. Bobe III, Bradley Marchand, Matthew S. Emigh	2023-08-12 20:59:39	Synthetic Aperture Sonar (SAS) imaging has become a crucial technology for underwater exploration because of its unique ability to maintain resolution at increasing ranges, a characteristic absent in conventional sonar techniques. However, the effective application of deep learning to SAS data processing is often limited due to the scarcity of labeled data. To address this challenge, this paper proposes MoCo-SAS that leverages self-supervised learning (SSL) for SAS data processing, classification, and pattern recognition. The experimental results demonstrate that MoCo-SAS significantly outperforms traditional supervised learning methods, as evidenced by significant improvements observed in terms of the F1-score. These findings highlight the potential of SSL in advancing the state-of-the-art in SAS data processing, offering promising avenues for enhanced underwater object detection and classification.	http://arxiv.org/abs/2308.11633v1	cs	arxiv					0.0	
"Intrinsic Alignment in redMaPPer clusters -- II. Radial alignment of
  satellites toward cluster centers"	Hung-Jin Huang	Rachel Mandelbaum, Peter E. Freeman, Yen-Chi Chen, Eduardo Rozo, Eli Rykoff	2017-04-20 18:00:06	We study the orientations of satellite galaxies in redMaPPer clusters constructed from the Sloan Digital Sky Survey at $0.1<z<0.35$ to determine whether there is any preferential tendency for satellites to point radially toward cluster centers. We analyze the satellite alignment (SA) signal based on three shape measurement methods (re-Gaussianization, de Vaucouleurs, and isophotal shapes), which trace galaxy light profiles at different radii. The measured SA signal depends on these shape measurement methods. We detect the strongest SA signal in isophotal shapes, followed by de Vaucouleurs shapes. While no net SA signal is detected using re-Gaussianization shapes across the entire sample, the observed SA signal reaches a statistically significant level when limiting to a subsample of higher luminosity satellites. We further investigate the impact of noise, systematics, and real physical isophotal twisting effects in the comparison between the SA signal detected via different shape measurement methods. Unlike previous studies, which only consider the dependence of SA on a few parameters, here we explore a total of 17 galaxy and cluster properties, using a statistical model averaging technique to naturally account for parameter correlations and identify significant SA predictors. We find that the measured SA signal is strongest for satellites with the following characteristics: higher luminosity, smaller distance to the cluster center, rounder in shape, higher bulge fraction, and distributed preferentially along the major axis directions of their centrals. Finally, we provide physical explanations for the identified dependences, and discuss the connection to theories of SA.	http://dx.doi.org/10.1093/mnras/stx2995	cs	arxiv					0.0	
"Reflections on Surrogate-Assisted Search-Based Testing: A Taxonomy and
  Two Replication Studies based on Industrial ADAS and Simulink Models"	Shiva Nejati	Lev Sorokin, Damir Safin, Federico Formica, Mohammad Mahdi Mahboob, Claudio Menghi	2023-04-28 20:34:30	Surrogate-assisted search-based testing (SA-SBT) aims to reduce the computational time for testing compute-intensive systems. Surrogates enhance testing techniques by improving test case generation focusing the testing budget on the most critical portions of the input domain. In addition, they can serve as approximations of the system under test (SUT) to predict tests' results instead of executing the tests on compute-intensive SUTs. This article reflects on the existing SA-SBT techniques, particularly those applied to system-level testing and often facilitated using simulators or complex test beds. Our objective is to synthesize different heuristic algorithms and evaluation methods employed in existing SA-SBT techniques and present a comprehensive view of SA-SBT solutions. In addition, by critically reviewing our previous work on SA-SBT, we aim to identify the limitations in our proposed algorithms and evaluation methods and to propose potential improvements. We present a taxonomy that categorizes and contrasts existing SA-SBT solutions and highlights key research gaps. To identify the evaluation challenges, we conduct two replication studies of our past SA-SBT solutions: One study uses industrial advanced driver assistance system (ADAS) and the other relies on a Simulink model benchmark. We compare our results with those of the original studies and identify the difficulties in evaluating SA-SBT techniques, including the impact of different contextual factors on results generalization and the validity of our evaluation metrics. Based on our taxonomy and replication studies, we propose future research directions, including re-considerations in the current evaluation metrics used for SA-SBT solutions, utilizing surrogates for fault localization and repair in addition to testing, and creating frameworks for large-scale experiments by applying SA-SBT to multiple SUTs and simulators.	http://arxiv.org/abs/2305.00083v1	cs	arxiv					0.0	
"Performance of a GPU-based Direct Summation Algorithm for Computation of
  Small Angle Scattering Profile"	Konstantin Berlin	Nail A. Gumerov, Ramani Duraiswami, David Fushman	2013-06-10 17:44:17	Small Angle Scattering (SAS) of X-rays or neutrons is an experimental technique that provides valuable structural information for biological macromolecules under physiological conditions and with no limitation on the molecular size. In order to refine molecular structure against experimental SAS data, ab initio prediction of the scattering profile must be recomputed hundreds of thousands of times, which involves the computation of the sinc kernel over all pairs of atoms in a molecule. The quadratic computational complexity of predicting the SAS profile limits the size of the molecules and and has been a major impediment for integration of SAS data into structure refinement protocols. In order to significantly speed up prediction of the SAS profile we present a general purpose graphical processing unit (GPU) algorithm, written in OpenCL, for the summation of the sinc kernel (Debye summation) over all pairs of atoms. This program is an order of magnitude faster than a parallel CPU algorithm, and faster than an FMM-like approximation method for certain input domains. We show that our algorithm is currently the fastest method for performing SAS computation for small and medium size molecules (around 50000 atoms or less). This algorithm is critical for quick and accurate SAS profile computation of elongated structures, such as DNA, RNA, and sparsely spaced pseudo-atom molecules.	http://arxiv.org/abs/1306.2258v1	cs	arxiv					0.0	
"State-averaged Monte Carlo configuration interaction applied to
  electronically excited states"	J. P. Coe	M. J. Paterson	2014-02-28 15:32:46	We introduce state-averaging into the method of Monte Carlo configuration interaction (SA-MCCI) to allow the stable and efficient calculation of excited states. We show that excited potential curves for H$_{3}$, including a crossing with the ground state, can be accurately reproduced using a small fraction of the FCI space. A recently introduced error measure for potential curves [J. P. Coe and M. J. Paterson, J. Chem. Phys., 137, 204108 (2012)] is shown to also be a fair approach when considering potential curves for multiple states. We demonstrate that potential curves for LiF using SA-MCCI agree well with the FCI results and the avoided crossing occurs correctly. The seam of conical intersections for CH$_{2}$ found by Yarkony [J. Chem. Phys., 104, 2932 (1996)] is used as a test for SA-MCCI and we compare potential curves from SA-MCCI with FCI results for this system for the first three triplet states. We then demonstrate the improvement from using SA-MCCI on the dipole of the $2$ $^{1}A_{1}$ state of carbon monoxide. We then look at vertical excitations for small organic molecules up to the size of butadiene where the SA-MCCI energies and oscillator strengths are compared with CASPT2 values [M. Schreiber, M. R. Silva-Junior, S. P. A. Sauer, and W. Thiel, J. Chem. Phys., 128, 134110 (2008)]. We finally see if the SA-MCCI results for these excitation energies can be improved by using MCCIPT2 with approximate natural orbitals when the PT2 space is not onerously large.	http://dx.doi.org/10.1063/1.4824888	cs	arxiv					0.0	
Kinetic and Cyber	Alexander Kott	Norbou Buchler, Kristin E. Schaefer	2015-11-11 15:25:46	We compare and contrast situation awareness in cyber warfare and in conventional, kinetic warfare. Situation awareness (SA) has a far longer history of study and applications in such areas as control of complex enterprises and in conventional warfare, than in cyber warfare. Far more is known about the SA in conventional military conflicts, or adversarial engagements, than in cyber ones. By exploring what is known about SA in conventional, also commonly referred to as kinetic, battles, we may gain insights and research directions relevant to cyber conflicts. We discuss the nature of SA in conventional (often called kinetic) conflict, review what is known about this kinetic SA (KSA), and then offer a comparison with what is currently understood regarding the cyber SA (CSA). We find that challenges and opportunities of KSA and CSA are similar or at least parallel in several important ways. With respect to similarities, in both kinetic and cyber worlds, SA strongly impacts the outcome of the mission. Also similarly, cognitive biases are found in both KSA and CSA. As an example of differences, KSA often relies on commonly accepted, widely used organizing representation - map of the physical terrain of the battlefield. No such common representation has emerged in CSA, yet.	http://arxiv.org/abs/1511.03531v1	cs	arxiv					0.0	
"Normalized and Geometry-Aware Self-Attention Network for Image
  Captioning"	Longteng Guo	Jing Liu, Xinxin Zhu, Peng Yao, Shichen Lu, Hanqing Lu	2020-03-19 16:54:16	Self-attention (SA) network has shown profound value in image captioning. In this paper, we improve SA from two aspects to promote the performance of image captioning. First, we propose Normalized Self-Attention (NSA), a reparameterization of SA that brings the benefits of normalization inside SA. While normalization is previously only applied outside SA, we introduce a novel normalization method and demonstrate that it is both possible and beneficial to perform it on the hidden activations inside SA. Second, to compensate for the major limit of Transformer that it fails to model the geometry structure of the input objects, we propose a class of Geometry-aware Self-Attention (GSA) that extends SA to explicitly and efficiently consider the relative geometry relations between the objects in the image. To construct our image captioning model, we combine the two modules and apply it to the vanilla self-attention network. We extensively evaluate our proposals on MS-COCO image captioning dataset and superior results are achieved when comparing to state-of-the-art approaches. Further experiments on three challenging tasks, i.e. video captioning, machine translation, and visual question answering, show the generality of our methods.	http://arxiv.org/abs/2003.08897v1	cs	arxiv					0.0	
Super learning in the SAS system	Alexander P. Keil	Daniel Westreich, Jessie K Edwards, Stephen R Cole	2018-05-21 13:53:08	Background and objective: Stacking is an ensemble machine learning method that averages predictions from multiple other algorithms, such as generalized linear models and regression trees. An implementation of stacking, called super learning, has been developed as a general approach to supervised learning and has seen frequent usage, in part due to the availability of an R package. We develop super learning in the SAS software system using a new macro, and demonstrate its performance relative to the R package.   Methods: Following previous work using the R SuperLearner package we assess the performance of super learning in a number of domains. We compare the R package with the new SAS macro in a small set of simulations assessing curve fitting in a predictive model as well in a set of 14 publicly available datasets to assess cross-validated accuracy.   Results: Across the simulated data and the publicly available data, the SAS macro performed similarly to the R package, despite a different set of potential algorithms available natively in R and SAS.   Conclusions: Our super learner macro performs as well as the R package at a number of tasks. Further, by extending the macro to include the use of R packages, the macro can leverage both the robust, enterprise oriented procedures in SAS and the nimble, cutting edge packages in R. In the spirit of ensemble learning, this macro extends the potential library of algorithms beyond a single software system and provides a simple avenue into machine learning in SAS.	http://arxiv.org/abs/1805.08058v3	cs	arxiv					0.0	
"Application of Stochastic and Deterministic Techniques for Uncertainty
  Quantification and Sensitivity Analysis of Energy Systems"	Majdi I. Radaideh	Mohammad I. Radaideh	2019-01-17 00:00:27	Sensitivity analysis (SA) and uncertainty quantification (UQ) are used to assess and improve engineering models. In this study, various methods of SA and UQ are described and applied in theoretical and practical examples for use in energy system analysis. This paper includes local SA (one-at-a-time linear perturbation), global SA (Morris screening), variance decomposition (Sobol indices), and regression-based SA. For UQ, stochastic methods (Monte Carlo sampling) and deterministic methods (using SA profiles) are used. Simple test problems are included to demonstrate the described methods where input parameter interactions, linear correlation, model nonlinearity, local sensitivity, output uncertainty, and variance contribution are explored. Practical applications of analyzing the efficiency and power output uncertainty of a molten carbonate fuel cell (MCFC) are conducted. Using different methods, the uncertainty in the MCFC responses is about 10%. Both SA and UQ methods agree on the importance ranking of the fuel cell operating temperature and cathode activation energy as the most influential parameters. Both parameters contribute to more than 90% of the maximum power and efficiency variance. The methods applied in this paper can be used to achieve a comprehensive mathematical understanding of a particular energy model, which can lead to better performance.	http://dx.doi.org/10.1002/er.4837	cs	arxiv					0.0	
Sensitivity analysis of a galaxy formation model	Piotr Oleskiewicz	Carlton M. Baugh	2019-10-03 22:10:06	"We present the first application of a variance-based sensitivity analysis (SA) to a model that aims to predict the evolution and properties of the whole galaxy population. SA is a well-established technique in other quantitative sciences, but is a relatively novel tool for the evaluation of astrophysical models. We perform a multi-parameter exploration of the GALFORM semi-analytic galaxy formation model, to compute how sensitive the present-day K-band luminosity function is to varying different model parameters. The parameter space is scanned using a low-discrepancy sampling technique proposed by Saltelli. We first demonstrate the usefulness of the SA approach by varying just two model parameters, one which controls supernova feedback and the other the heating of gas by AGN. The SA analysis matches our physical intuition regarding how these parameters affect the predictions for different parts of the galaxy luminosity function. We then use SA to compute Sobol' sensitivity indices varying seven model parameters, connecting the variance in the model output to the variance in the input parameters. The sensitivity is computed in luminosity bins, allowing us to probe the origin of the model predictions in detail. We discover that the SA correctly identifies the least- and most important parameters. Moreover, the SA also captures the combined responses of varying multiple parameters at the same time. Our study marks a much needed step away from the traditional ""one-at-a-time"" parameter variation often used in this area and improves the transparency of multi-parameter models of galaxy formation."	http://dx.doi.org/10.1093/mnras/stz3560	cs	arxiv					0.0	
SA-Net: Shuffle Attention for Deep Convolutional Neural Networks	Qing-Long Zhang Yu-Bin Yang	Aucun	2021-01-30 15:23:17	"Attention mechanisms, which enable a neural network to accurately focus on all the relevant elements of the input, have become an essential component to improve the performance of deep neural networks. There are mainly two attention mechanisms widely used in computer vision studies, \textit{spatial attention} and \textit{channel attention}, which aim to capture the pixel-level pairwise relationship and channel dependency, respectively. Although fusing them together may achieve better performance than their individual implementations, it will inevitably increase the computational overhead. In this paper, we propose an efficient Shuffle Attention (SA) module to address this issue, which adopts Shuffle Units to combine two types of attention mechanisms effectively. Specifically, SA first groups channel dimensions into multiple sub-features before processing them in parallel. Then, for each sub-feature, SA utilizes a Shuffle Unit to depict feature dependencies in both spatial and channel dimensions. After that, all sub-features are aggregated and a ""channel shuffle"" operator is adopted to enable information communication between different sub-features. The proposed SA module is efficient yet effective, e.g., the parameters and computations of SA against the backbone ResNet50 are 300 vs. 25.56M and 2.76e-3 GFLOPs vs. 4.12 GFLOPs, respectively, and the performance boost is more than 1.34% in terms of Top-1 accuracy. Extensive experimental results on common-used benchmarks, including ImageNet-1k for classification, MS COCO for object detection, and instance segmentation, demonstrate that the proposed SA outperforms the current SOTA methods significantly by achieving higher accuracy while having lower model complexity. The code and models are available at https://github.com/wofmanaf/SA-Net."	http://arxiv.org/abs/2102.00240v1	cs	arxiv					0.0	
"On the Philosophical, Cognitive and Mathematical Foundations of
  Symbiotic Autonomous Systems (SAS)"	Yingxu Wang	Fakhri Karray, Sam Kwong, Konstantinos N. Plataniotis, Henry Leung, Ming Hou, Edward Tunstel, Imre J. Rudas, Ljiljana Trajkovic, Okyay Kaynak, Janusz Kacprzyk, Mengchu Zhou, Michael H. Smith, Philip Chen, Shushma Patel	2021-02-11 05:44:25	Symbiotic Autonomous Systems (SAS) are advanced intelligent and cognitive systems exhibiting autonomous collective intelligence enabled by coherent symbiosis of human-machine interactions in hybrid societies. Basic research in the emerging field of SAS has triggered advanced general AI technologies functioning without human intervention or hybrid symbiotic systems synergizing humans and intelligent machines into coherent cognitive systems. This work presents a theoretical framework of SAS underpinned by the latest advances in intelligence, cognition, computer, and system sciences. SAS are characterized by the composition of autonomous and symbiotic systems that adopt bio-brain-social-inspired and heterogeneously synergized structures and autonomous behaviors. This paper explores their cognitive and mathematical foundations. The challenge to seamless human-machine interactions in a hybrid environment is addressed. SAS-based collective intelligence is explored in order to augment human capability by autonomous machine intelligence towards the next generation of general AI, autonomous computers, and trustworthy mission-critical intelligent systems. Emerging paradigms and engineering applications of SAS are elaborated via an autonomous knowledge learning system that symbiotically works between humans and cognitive robots.	http://dx.doi.org/10.1098/rsta.2020.0362	cs	arxiv					0.0	
"A Comparative Study of Modular and Joint Approaches for
