titre	auteur	co_auteurs	date	texte	url	catégorie	source	id_post_reddit	subreddit	upvotes	score	nombre_commentaires	flairs
  quadratic assignment problem"	Gerald Paul	Aucun	2011-11-05 21:43:56	The quadratic assignment problem (QAP) is one of the most difficult combinatorial optimization problems. One of the most powerful and commonly used heuristics to obtain approximations to the optimal solution of the QAP is simulated annealing (SA). We present an efficient implementation of the SA heuristic which performs more than 100 times faster then existing implementations for large problem sizes and a large number of SA iterations.	http://arxiv.org/abs/1111.1353v1	cs	arxiv					0.0	
Quantum Annealing for Clustering	Kenichi Kurihara	Shu Tanaka, Seiji Miyashita	2014-08-09 05:31:06	This paper studies quantum annealing (QA) for clustering, which can be seen as an extension of simulated annealing (SA). We derive a QA algorithm for clustering and propose an annealing schedule, which is crucial in practice. Experiments show the proposed QA algorithm finds better clustering assignments than SA. Furthermore, QA is as easy as SA to implement.	http://arxiv.org/abs/1408.2035v1	cs	arxiv					0.0	
Revising SA-CCR	Mourad Berrahoui	Othmane Islah, Chris Kenyon	2019-02-22 09:03:34	From SA-CCR to RSA-CCR: making SA-CCR self-consistent and appropriately risk-sensitive by cashflow decomposition in a 3-Factor Gaussian Market Model	http://arxiv.org/abs/1902.08405v2	cs	arxiv					0.0	
Stochastic Approximation on Riemannian manifolds	Suhail M. Shah	Aucun	2017-11-29 10:13:01	The standard theory of stochastic approximation (SA) is extended to the case when the constraint set is a Riemannian manifold. Specifically, the standard ODE method for analyzing SA schemes is extended to iterations constrained to stay on a manifold using a retraction mapping. In addition, for submanifolds of a Euclidean space, a framework is developed for a projected SA scheme with approximate retractions. The framework is also extended to non-differentiable constraint sets.	http://arxiv.org/abs/1711.10754v1	cs	arxiv					0.0	
Extragalactic Objects in Basle Fields	S. Bilir	Y. Karatas, S. Ak	2003-03-21 08:21:40	We discriminated the extragalactic objects (galaxies and quasars) from stars for Basle star fields, Plaut I, SA 54, and SA 82 by comparison of Basle fields and APS POSS I finder charts. Their numbers are 187, 70, and 93 for Plaut I, SA 54, and SA 82, respectively. Most of these objects are apparently faint in V, and they cause an overestimated local luminosity function for absolutely faint magnitudes, M(V) > 5. This effect is more conspicious for the field Plaut I.	http://arxiv.org/abs/astro-ph/0303485v2	cs	arxiv					0.0	
"Monolayer Characteristics of Pyrene Mixed with Stearic Acid at the
  Air-Water Interface"	Md. N. Islam	D. Bhattacharjee, Syed Arshad Hussain	2008-07-16 21:10:15	In the present communication we report the monolayer characteristics of pyrene mixed with stearic acid (SA) at the air-water interface. The monolayer properties are investigated by recording and analyzing the surface pressure-area per molecule isotherm (pi-A) of the pyrene-SA mixed films. It is observed that the pyrene and SA are miscible in the mixed monolayer. This miscibility/nonideality leads to phase separation between the constituent components (pyrene and SA). BAM image of the mixed monolayer confirms the miscibility or nonideal mixing at the mixed monolayer.	http://dx.doi.org/10.1142/S0218625X08011378	cs	arxiv					0.0	
"A GPU implementation of the Simulated Annealing Heuristic for the
  Quadratic Assignment Problem"	Gerald Paul	Aucun	2012-08-13 19:30:44	The quadratic assignment problem (QAP) is one of the most difficult combinatorial optimization problems. An effective heuristic for obtaining approximate solutions to the QAP is simulated annealing (SA). Here we describe an SA implementation for the QAP which runs on a graphics processing unit (GPU). GPUs are composed of low cost commodity graphics chips which in combination provide a powerful platform for general purpose parallel computing. For SA runs with large numbers of iterations, we find performance 50-100 times better than that of a recent non-parallel but very efficient implementation of SA for the QAP	http://arxiv.org/abs/1208.2675v1	cs	arxiv					0.0	
Syntax Aware LSTM Model for Chinese Semantic Role Labeling	Feng Qian	Lei Sha, Baobao Chang, Lu-chen Liu, Ming Zhang	2017-04-03 02:10:19	As for semantic role labeling (SRL) task, when it comes to utilizing parsing information, both traditional methods and recent recurrent neural network (RNN) based methods use the feature engineering way. In this paper, we propose Syntax Aware Long Short Time Memory(SA-LSTM). The structure of SA-LSTM modifies according to dependency parsing information in order to model parsing information directly in an architecture engineering way instead of feature engineering way. We experimentally demonstrate that SA-LSTM gains more improvement from the model architecture. Furthermore, SA-LSTM outperforms the state-of-the-art on CPB 1.0 significantly according to Student t-test ($p<0.05$).	http://arxiv.org/abs/1704.00405v2	cs	arxiv					0.0	
Theoretical Study and Comparison of SPSA and RDSA Algorithms	Yiwen Chen	Aucun	2021-07-24 05:50:17	Stochastic approximation (SA) algorithms are widely used in system optimization problems when only noisy measurements of the system are available. This paper studies two types of SA algorithms in a multivariate Kiefer-Wolfowitz setting: random-direction SA (RDSA) and simultaneous-perturbation SA (SPSA), and then describes the bias term, convergence, and asymptotic normality of RDSA algorithms. The gradient estimations in RDSA and SPSA have different forms and, consequently, use different types of random perturbations. This paper looks at various valid distributions for perturbations in RDSA and SPSA and then compares the two algorithms using mean-square errors computed from asymptotic distribution. From both a theoretical and numerical point of view, we find that SPSA generally outperforms RDSA.	http://arxiv.org/abs/2107.12771v1	cs	arxiv					0.0	
"Finding Semi-Analytic Solutions of Power System Differential-Algebraic
  Equations for Fast Transient Stability Simulation"	Nan Duan	Kai Sun	2014-12-02 13:28:12	This paper studies the semi-analytic solution (SAS) of a power system's differential-algebraic equation. A SAS is a closed-form function of symbolic variables including time, the initial state and the parameters on system operating conditions, and hence able to directly give trajectories on system state variables, which are accurate for at least a certain time window. A two-stage SAS-based approach for fast transient stability simulation is proposed, which offline derives the SAS by the Adomian Decomposition Method and online evaluates the SAS for each of sequential time windows until making up a desired simulation period. When applied to fault simulation, the new approach employs numerical integration only for the fault-on period to determine the post-disturbance initial state of the SAS. The paper further analyzes the maximum length of a time window for a SAS to keep its accuracy, and accordingly, introduces a divergence indicator for adaptive time windows. The proposed SAS-based new approach is validated on the IEEE 10-machine, 39-bus system.	http://arxiv.org/abs/1412.0904v2	cs	arxiv					0.0	
Fair Resource Allocation in Optical Networks under Tidal Traffic	Tania Panayiotou	Georgios Ellinas	2020-05-12 15:48:44	We propose an alpha-fair routing and spectrum allocation (RSA) framework for reconfigurable elastic optical networks under modeled tidal traffic, that is based on the maximization of the social welfare function parameterized by a scalar alpha (the inequality aversion parameter). The objective is to approximate an egalitarian spectrum allocation (SA) that maximizes the minimum possible SA over all connections contending for the network resources, shifting from the widely used utilitarian SA that merely maximizes the network efficiency. A set of existing metrics are examined (i.e., connection blocking, resource utilization, coefficient of variation (CV) of utilities), and a set of new measures are also introduced (i.e., improvement on connection over- (COP) and under-provisioning (CUP), CV of unserved traffic), allowing a network operator to derive and evaluate in advance a set of alpha-fair RSA solutions and select the one that best fits the performance requirements of both the individual connections and the overall network. We show that an egalitarian SA better utilizes the network resources by significantly improving both COP (up to 20%) and CUP (up to 80%), compared to the utilitarian allocation, while attaining zero blocking. Importantly, the CVs of utilities and unserved traffic indicate that a SA that is fairest with respect to the amount of utilities allocated to the connections does not imply that the SA is also fairest with respect to the achievable QoS of the connections, while an egalitarian SA better approximates a fairest QoS-based SA.	http://dx.doi.org/10.1109/GLOBECOM42002.2020.9322381	cs	arxiv					0.0	
The History of Software Architecture - In the Eye of the Practitioner	Henry Muccini	Patricia Lago, Karthik Vaidyanathan, Francesco Osborne, Eltjo Poort	2018-06-11 15:25:14	Software architecture (SA) is celebrating 25 years. This is so if we consider the seminal papers establishing SA as a distinct discipline and scientific publications that have identified cornerstones of both research and practice, like architecture views, architecture description languages, and architecture evaluation. With the pervasive use of cloud provisioning, the dynamic integration of multi-party distributed services, and the steep increase in the digitalization of business and society, making sound design decisions encompasses an increasingly-large and complex problem space. The role of SA is essential as never before, so much so that no organization undertakes `serious' projects without the support of suitable architecture practices. But, how did SA practice evolve in the past 25 years? and What are the challenges ahead? There have been various attempts to summarize the state of research and practice of SA. Still, we miss the practitioners' view on the questions above. To fill this gap, we have first extracted the top-10 topics resulting from the analysis of 5,622 scientific papers. Then, we have used such topics to design an online survey filled out by 57 SA practitioners with 5 to 20+ years of experience. We present the results of the survey with a special focus on the SA topics that SA practitioners perceive, in the past, present and future, as the most impactful. We finally use the results to draw preliminary takeaways.	http://arxiv.org/abs/1806.04055v1	cs	arxiv					0.0	
"The Deviation of the Broad-line Region Size Between Reverberation
  Mapping and Spectroastrometry"	Xiaer Zhang	Zhicheng He, Tinggui Wang, Hengxiao Guo	2021-04-23 05:18:50	The combination of the linear size from reverberation mapping (RM) and the angular distance of the broad line region (BLR) from spectroastrometry (SA) in active galactic nuclei (AGNs) can be used to measure the Hubble constant $H_0$. Recently, Wang et al. (2020) successfully employed this approach and estimated $H_0$ from 3C 273. However, there may be a systematic deviation between the response-weighted radius (RM measurement) and luminosity-weighted radius (SA measurement), especially when different broad lines are adopted for size indicators (e.g., \hb\ for RM and \pa\ for SA). Here we evaluate the size deviations measured by six pairs of hydrogen lines (e.g., \hb, \ha\ and \pa) via the locally optimally emitting cloud (LOC) models of BLR. We find that the radius ratios $K$(=$R_{\rm SA}$/$R_{\rm RM}$) of the same line deviated systematically from 1 (0.85-0.88) with dispersions between 0.063-0.083. Surprisingly, the $K$ values from the \pa(SA)/\hb(RM) and \ha(SA)/\hb(RM) pairs not only are closest to 1 but also have considerably smaller uncertainty. Considering the current infrared interferometry technology, the \pa(SA)/\hb(RM) pair is the ideal choice for the low redshift objects in the SARM project. In the future, the \ha(SA)/\hb(RM) pair could be used for the high redshift luminous quasars. These theoretical estimations of the SA/RM radius pave the way for the future SARM measurements to further constrain the standard cosmological model.	http://dx.doi.org/10.3847/1538-4357/abfb6b	cs	arxiv					0.0	
"A Novel Full-Polarization SAR Images Ship Detector Based on the
  Scattering Mechanisms and the Wave Polarization Anisotropy"	Chuan Zhang	Gui Gao, Linlin Zhang, C. Chen, S. Gao, Libo Yao, Shiquan Gou	2021-12-06 12:24:12	Synthetic aperture radar (SAR) is considered being a good option for earth observation with its unique advantages. In this paper, we proposed an adaptive ship detector using full-polarization SAR images. First, by thoroughly investigating the scattering characteristics between ships and their background, and the wave polarization anisotropy, a novel ship detector is proposed by jointing the two characteristics, named Scattering-Anisotropy joint (joint-SA). Based on the theoretical analysis, we showed that the joint-SA is an effective physical quantity to show the difference between the ship and its background, and thus joint-SA can be used for ship detection of full-polarization image data. Second, the generalized Gamma distribution was used to characterize the joint-SA statistics of sea clutter with a large range of homogeneity. As a result, an adaptive constant false alarm rate (CFAR) method was implemented based on the joint-SA. Finally, RADARSAT-2 and GF-3 data in C-band and ALOS data in L-band are used for verification. We tested on five datasets, and the experimental results verify the correctness and superiority of the constant false alarm rate (CFAR) method based on the joint-SA. In addition, the experimental results also showed that the signal-clutter ratio (SCR) of the proposed ship detector joint-SA (33.17 dB, 35.98 dB, 57.25 dB) is better than that of DBSP (8.92 dB, 3.43 dB, 25.40 dB) and RsDVH (17.28 dB, 11.17 dB, 54.55 dB). More importantly, the proposed detector joint-SA has higher detection accuracy and a lower false alarm rate.	http://arxiv.org/abs/2112.02965v2	cs	arxiv					0.0	
"A novel deep learning-based approach for sleep apnea detection using
  single-lead ECG signals"	Anh-Tu Nguyen	Thao Nguyen, Huy-Khiem Le, Huy-Hieu Pham, Cuong Do	2022-08-05 23:46:20	Sleep apnea (SA) is a type of sleep disorder characterized by snoring and chronic sleeplessness, which can lead to serious conditions such as high blood pressure, heart failure, and cardiomyopathy (enlargement of the muscle tissue of the heart). The electrocardiogram (ECG) plays a critical role in identifying SA since it might reveal abnormal cardiac activity. Recent research on ECG-based SA detection has focused on feature engineering techniques that extract specific characteristics from multiple-lead ECG signals and use them as classification model inputs. In this study, a novel method of feature extraction based on the detection of S peaks is proposed to enhance the detection of adjacent SA segments using a single-lead ECG. In particular, ECG features collected from a single lead (V2) are used to identify SA episodes. On the extracted features, a CNN model is trained to detect SA. Experimental results demonstrate that the proposed method detects SA from single-lead ECG data is more accurate than existing state-of-the-art methods, with 91.13% classification accuracy, 92.58% sensitivity, and 88.75% specificity. Moreover, the further usage of features associated with the S peaks enhances the classification accuracy by 0.85%. Our findings indicate that the proposed machine learning system has the potential to be an effective method for detecting SA episodes.	http://arxiv.org/abs/2208.03408v2	cs	arxiv					0.0	
The Hyperinvarinat Subspace Problem	Sa Ge Lee	Aucun	2023-06-24 11:33:32	The hyperinvariant subspace problem is solved in the setting of Hilbert and right Hamilton space, motivated by my earlier works in the invariant subspace problem.	http://arxiv.org/abs/2306.13940v1	cs	arxiv					0.0	
Nilpotence, radicaux et structures monoïdales	Yves André	Bruno Kahn, avec un appendice de Peter O'Sullivan	2002-03-26 19:14:31	For $K$ a field, a Wedderburn $K$-linear category is a $K$-linear category $\sA$ whose radical $\sR$ is locally nilpotent and such that $\bar \sA:=\sA/\sR$ is semi-simple and remains so after any extension of scalars. We prove existence and uniqueness results for sections of the projection $\sA\to \bar\sA$, in the vein of the theorems of Wedderburn. There are two such results: one in the general case and one when $\sA$ has a monoidal structure for which $\sR$ is a monoidal ideal. The latter applies notably to Tannakian categories over a field of characteristic zero, and we get a generalisation of the Jacobson-Morozov theorem: the existence of a pro-reductive envelope $\Pred(G)$ associated to any affine group scheme $G$ over $K$. Other applications are given in this paper as well as in a forthcoming one on motives.	http://arxiv.org/abs/math/0203273v3	cs	arxiv					0.0	
Operator Segal Algebras in Fourier Algebras	Brian E. Forrest	Nico Spronk, Peter J. Wood	2006-01-20 19:19:07	Let G be a locally compact group, A(G) its Fourier algebra and L1(G) the space of Haar integrable functions on G. We study the Segal algebra SA(G)=A(G)\cap L1(G) in A(G). It admits an operator space structure which makes it a completely contractive Banach algebra. We compute the dual space of SA(G). We use it show that restriction operator u|->u|H:SA(G)->A(H), for some non-open closed subgroups H, is a surjective complete qutient map. We also show that if N is a non-compact closed subgroup, then the averaging operator tau_N:SA(G)->L1(G/N), tau_N u(sN)=\int_N u(sn)dn is a surjective complete quotient map. This puts an operator space perspective on the philosophy that SA(G) is ``locally A(G) while globally L1''. Also, using the operator space structure we can show that SA(G) is operator amenable exactly when when G is compact; and we can show that it is always operator weakly amenable. To obtain the latter fact, we use E. Samei's theory of hyper-Tauberian Banach algebras.	http://arxiv.org/abs/math/0601509v1	cs	arxiv					0.0	
Operator Imprecision and Scaling of Shor's Algorithm	C. Ray Hill	George F. Viamontes	2008-04-18 17:59:35	Shor's algorithm (SA) is a quantum algorithm for factoring integers. Since SA has polynomial complexity while the best classical factoring algorithms are sub-exponential, SA is cited as evidence that quantum computers are more powerful than classical computers. SA is critically dependent on the Quantum Fourier Transform (QFT) and it is known that the QFT is sensitive to errors in the quantum state input to it. In this paper, we show that the polynomial scaling of SA is destroyed by input errors to the QFT part of the algorithm. We also show that Quantum Error Correcting Codes (QECC) are not capable of suppressing errors due to operator imprecision and that propagation of operator precision errors is sufficient to severely degrade the effectiveness of SA. Additionally we show that operator imprecision in the error correction circuit for the Calderbank-Shor-Steane QECC is mathematically equivalent to decoherence on every physical qubit in a register. We conclude that, because of the effect of operator precision errors, it is likely that physically realizable quantum computers will be capable of factoring integers no more efficiently than classical computers.	http://arxiv.org/abs/0804.3076v1	cs	arxiv					0.0	
"SA-IGA: A Multiagent Reinforcement Learning Method Towards Socially
  Optimal Outcomes"	Chengwei Zhang	Xiaohong Li, Jianye Hao, Siqi Chen, Karl Tuyls, Wanli Xue	2018-03-08 10:02:42	In multiagent environments, the capability of learning is important for an agent to behave appropriately in face of unknown opponents and dynamic environment. From the system designer's perspective, it is desirable if the agents can learn to coordinate towards socially optimal outcomes, while also avoiding being exploited by selfish opponents. To this end, we propose a novel gradient ascent based algorithm (SA-IGA) which augments the basic gradient-ascent algorithm by incorporating social awareness into the policy update process. We theoretically analyze the learning dynamics of SA-IGA using dynamical system theory and SA-IGA is shown to have linear dynamics for a wide range of games including symmetric games. The learning dynamics of two representative games (the prisoner's dilemma game and the coordination game) are analyzed in details. Based on the idea of SA-IGA, we further propose a practical multiagent learning algorithm, called SA-PGA, based on Q-learning update rule. Simulation results show that SA-PGA agent can achieve higher social welfare than previous social-optimality oriented Conditional Joint Action Learner (CJAL) and also is robust against individually rational opponents by reaching Nash equilibrium solutions.	http://arxiv.org/abs/1803.03021v1	cs	arxiv					0.0	
"A plug-and-play type field-deployable bio-agent free salicylic acid
  sensing system"	Bhuwan Kashyap	Ratnesh Kumar	2021-05-04 03:44:30	Salicylic acid (SA) is a primary phytohormone released in response to stress, particularly biotic infections in plants. Monitoring SA levels may provide a way for early disease detection in crops providing a way for applying effective measures for reducing agricultural losses while increase our agricultural efficiency. Additionally, SA is an important chemical used extensively in the pharmaceutical and healthcare industry due to its analgesic and anti-inflammatory properties. Developing a fast and accurate way for monitoring SA levels in human serum can have a life-saving impact for patients suffering from overdosing and/or mis-dosing. In this work, we present a low-cost, portable, and field-deployable electrochemical SA sensing system aimed towards achieving the above-mentioned goals. The developed sensor consists of a plug-and-play type device equipped with specialized designed high accuracy sensing electronics and a novel procedure for robust data analysis. The developed sensor exhibits excellent linearity and sensitivity and selectivity. The practical applicability of the developed sensor was also demonstrated by measuring SA levels in real samples with good accuracy.	http://arxiv.org/abs/2105.04417v1	cs	arxiv					0.0	
Growth in Sumsets of Higher Convex Functions	Peter J. Bradshaw	Aucun	2021-11-05 16:14:44	The main results of this paper concern growth in sums of a $k$-convex function $f$. Firstly, we streamline the proof of a growth result for $f(A)$ where $A$ has small additive doubling, and improve the bound by removing logarithmic factors. The result yields an optimal bound for \[ |2^k f(A) - (2^k-1)f(A)|. \]   We also generalise a recent result of Hanson, Roche-Newton and Senger, by proving that for any finite $A\subset \mathbb{R}$   \[ | 2^k f(sA-sA) - (2^k-1) f(sA-sA)| \gg_s |A|^{2s} \] where $s = \frac{k+1}{2}$. This allows us to prove that, given any natural number $s \in \mathbb{N}$, there exists $m = m(s)$ such that if $A \subset \mathbb{R}$, then \begin{equation}\label{conj A-Aus} |(sA-sA)^{(m)}| \gg_s |A|^{s}. \end{equation}   This is progress towards a conjecture which states that the above inequality can be replaced with   \[|(A-A)^{(m)}| \gg_s |A|^{s}.\]   Developing methods of Solymosi, and Bloom and Jones, we present some new sum-product type results in the complex numbers $\mathbb{C}$ and in the function field $\mathbb{F}_q((t^{-1}))$.	http://arxiv.org/abs/2111.03586v1	cs	arxiv					0.0	
Neural Simulated Annealing	Alvaro H. C. Correia	Daniel E. Worrall, Roberto Bondesan	2022-03-04 09:19:28	Simulated annealing (SA) is a stochastic global optimisation technique applicable to a wide range of discrete and continuous variable problems. Despite its simplicity, the development of an effective SA optimiser for a given problem hinges on a handful of carefully handpicked components; namely, neighbour proposal distribution and temperature annealing schedule. In this work, we view SA from a reinforcement learning perspective and frame the proposal distribution as a policy, which can be optimised for higher solution quality given a fixed computational budget. We demonstrate that this Neural SA with such a learnt proposal distribution, parametrised by small equivariant neural networks, outperforms SA baselines on a number of problems: Rosenbrock's function, the Knapsack problem, the Bin Packing problem, and the Travelling Salesperson problem. We also show that Neural SA scales well to large problems - generalising to significantly larger problems than the ones seen during training - while achieving comparable performance to popular off-the-shelf solvers and other machine learning methods in terms of solution quality and wall-clock time.	http://arxiv.org/abs/2203.02201v1	cs	arxiv					0.0	
"Design of a stiffness adjustable magnetic fluid shock absorber based on
